userID	username	utc off	profile created	favorites	followers	following	tweets	retweetID	retweet user	retweet count	text	quote	url	lat	lon	tweetID	relevant	com_vape	news_vape	policy_vape	health_vape	use_vape	pro_vape	anti_vape	procure_vape	addiction_vape	
'108679657	klayton86		Tue Jan 26 18:30:22 +0000 2010	7032	6642	6416	78097			0	 This pic always makes me wanna # Vape https://t.co/5LSGBCxa2V 	  	http://twitter.com/klayton86/status/1037896282621308928			'1037896282621308928	1	0	0	0	0	1.2	1	0			
'130678571	lozaniel		Thu Apr 08 00:25:22 +0000 2010	62144	335	274	34869			0	 that's gross tho cuz u gotta inhale it doodoo particles first to get the vape out. 	 Please retweet if you have ever used vape as a bathroom air freshener \U0001f4a8 	http://twitter.com/lozaniel/status/1034182491802947584			'1034182491802947584	1	0	0	0	0	0	0	0			
'1344930224	RastaVapors		Thu Apr 11 17:52:31 +0000 2013	9427	6162	1560	8089			0	 Research shows vaping # PEPPERMINT is great for allergy-induced # asthma sufferers.  IT ALSO CURES HICCUPS -  PREVENTS SNORING -  & OTHER SECRET HEALTH BENEFITS! _newline_ https://t.co/LS6lwBbB0e _newline_ # vaping # vape # vapes # eliquid # ejuice # bestvape # vapesale # Instavape # vapeshop # subohm # vaper # vapor https://t.co/FeP0nCFMUI 	  	http://twitter.com/RastaVapors/status/1031650855659950080			'1031650855659950080	1	0	0	0	1	0	1	0			
'138600898	yingfo		Fri Apr 30 01:01:28 +0000 2010	14133	637	661	23818			0	 Starrcast is gonna smell like vape 	  	http://twitter.com/yingfo/status/1034993680149618688			'1034993680149618688	1	0	0	0	0	0	0	0			
'1013716820073668608	HiraniTwinkal		Mon Jul 02 09:31:38 +0000 2018	0	1	77	292			0	 E Shisha cig Cigarettes 60W 2200mAh Box Mod Starter Kit Pen Vape Electronic _newline_ @YouTube https://t.co/6VoFroWdXD 	  	http://twitter.com/HiraniTwinkal/status/1031481650754904065			'1031481650754904065	1	1	0	0	0	0	0	0			
'2904434414	MyStudentBudget		Wed Nov 19 11:39:03 +0000 2014	19924	366	429	7013			0	 @donneayop2 sHaT -  omg vApE LiFe 	  	http://twitter.com/MyStudentBudget/status/1041643003809394688			'1041643003809394688	1	0	0	0	0	0	0	1			
'322259193	ECIGCANADAZONE		Wed Jun 22 21:58:41 +0000 2011	23	1200	1262	285792			0	 SHOP AT AND GET YOUR VAPE ON. Ecig Canada Zone Electronic Cigarettes ECigarette... https://t.co/9Zu1T0jFJa 	  	http://twitter.com/ECIGCANADAZONE/status/1037445443712675849			'1037445443712675849	1	1	0	0	0	0	0	0			
'2909505971	smokerslogicksm		Sun Dec 07 16:53:41 +0000 2014	447	1353	1906	343778			0	 Headline News: # Vaping Is Safer Than Smoking - # Media Silent. https://t.co/5vRQhteOBy  # VapeT-Shirts https://t.co/KgXCdQ4USz 	  	http://twitter.com/smokerslogicksm/status/1031025732867289088			'1031025732867289088	1	0	0	0	1	0	1	0			
'1005563299130494976	chickenbts		Sat Jun 09 21:32:27 +0000 2018	310	76	27	673			0	 @koolkidawsome I have a used juul if you wanna trade \U0001f921 	  	http://twitter.com/chickenbts/status/1034303674028384256			'1034303674028384256	1	0	0	0	0	0	1	0			
'2973040762	Vapofolies		Sun Jan 11 12:56:47 +0000 2015	59	429	767	12521			0	 Gas Mods Nixon S BF RDA # vapote # vape # vaping # deals # bonplan # vapofolies # ecig  https://t.co/63DcY6BnCB 	  	http://twitter.com/Vapofolies/status/1037165689012989953			'1037165689012989953	1	1	0	0	0	0	0	0			
'849933881528668160	VapingAve40		Thu Apr 06 10:36:43 +0000 2017	20	45	60	147421			0	 New Vaping VOOPOO Vmate 200W Kit with Uforce T1 Tank 8ml https://t.co/Qh3dCCgBnG https://t.co/N2HFlgekPD 	  	http://twitter.com/VapingAve40/status/1037329861377908737			'1037329861377908737	1	1	0	0	0	0	0	0			
'849933881528668160	VapingAve40		Thu Apr 06 10:36:43 +0000 2017	20	45	60	122573			0	 New Vaping Eleaf iStick Pico S Kit with battery https://t.co/ndlCu8kPqD https://t.co/Tps1QVf6xk 	  	http://twitter.com/VapingAve40/status/1033959886269235200			'1033959886269235200	1	1	0	0	0	0	0	0			
'2584336196	AlbertGIBrammer		Mon Jun 23 17:28:22 +0000 2014	5170	146	188	15721			0	 # Vaping I do not want to be sat on a bus or train next to people vaping. The Science regarding their safety is still undecided -  but recent work has shown it is not safe. _newline_ https://t.co/mF7KMqpjQZ 	  	http://twitter.com/AlbertGIBrammer/status/1030446748865638400			'1030446748865638400	1	0	0	0	1	0	0	1			
'1041056265009614848	crackersnatchr		Sat Sep 15 20:08:50 +0000 2018	4	1	56	3			0	 mom: if you do that one more time-      12yr old:what woman you can't do nothin to me                                                                   mom: I'll take ur juul away                        12yr old: OK OK FINE I'LL DO WHATEVER U SAY 	  	http://twitter.com/crackersnatchr/status/1041095197902422022			'1041095197902422022	1	0	0	0	0	0	1	0			
'849933881528668160	VapingAve40		Thu Apr 06 10:36:43 +0000 2017	20	45	60	168628			0	 New Vaping Smok G-PRIV Baby kit https://t.co/vJGnGrU3zI https://t.co/zTJnnaAswC 	  	http://twitter.com/VapingAve40/status/1039946940132220928			'1039946940132220928	1	1	0	0	0	0	0	0			
'930468054676406276	garfieldvore		Tue Nov 14 16:10:46 +0000 2017	6079	57	228	1098			0	 *perfect standing front handspring into the room* _newline_ Whatsup losers _newline_ *puts on sunglasses* _newline_ I'm here _newline_ *cuffs jeans* _newline_ I'm queer _newline_ *reloads juul* _newline_ And I'm ready to die  _newline_ Alexa play White Ferrari 	  	http://twitter.com/garfieldvore/status/1037162753126019073			'1037162753126019073	1	0	0	0	0	1	1	0			
'849933881528668160	VapingAve40		Thu Apr 06 10:36:43 +0000 2017	20	45	60	145876			0	 New Vaping Vgod Pro Mech 2 Kit https://t.co/F1qrv9CRuk https://t.co/AysSf3f4Lt 	  	http://twitter.com/VapingAve40/status/1037185631011725315			'1037185631011725315	1	1	0	0	0	0	0	0			
'849933881528668160	VapingAve40		Thu Apr 06 10:36:43 +0000 2017	20	45	60	170830			0	 New Vaping Eleaf Melo 4 Atomizer - 2ml & 4.5ml https://t.co/AWdt3NDso3 https://t.co/mKSQCsrJJb 	  	http://twitter.com/VapingAve40/status/1040190076200865792			'1040190076200865792	1	1	0	0	0	0	0	0			
'130615364	DaveFGKelly		Wed Apr 07 20:34:14 +0000 2010	18043	10134	5848	85082			0	 My cat is fascinated by the vape. Usually she tries to catch it https://t.co/97Q6TWbqGl 	  	http://twitter.com/DaveFGKelly/status/1035699282328920064			'1035699282328920064	1	0	0	0	0	0	1	0			
'817562674204700673	FalconGT_74		Sat Jan 07 02:45:05 +0000 2017	109	0	19	230			0	 I liked a @YouTube video https://t.co/LGlx4Xr0mK THAT'S CRINGE: Car Vape 	  	http://twitter.com/FalconGT_74/status/1038179293958823937			'1038179293958823937	1	0	0	0	0	0	1	0			
'23436775	iandavies_		Mon Mar 09 13:50:07 +0000 2009	1546	319	462	622			0	 @jeremycorbyn Big fan of yours jezza but have you been to a high street lately? It's full of smack heads -  charity shops and vape shops! And they are the better ones 	  	http://twitter.com/iandavies_/status/1040918904724488192			'1040918904724488192	1	0	0	0	0	0	1	0			
'2600455051	EmptyWalIetslrh		Wed Jul 02 20:39:05 +0000 2014	18644	1958	4773	19670			0	 My mum got my dad a e-cig cause he's Tryna quit smoking but broke his last e-cig (on purpose) and the new one is tiny and now my dads singing 'baby vape do do do do do do do do' and I'm ready to swing 	  	http://twitter.com/EmptyWalIetslrh/status/1040951730148724736			'1040951730148724736	1	0	0	0	1	0	1	0			
'735848996	Davis_1414		Sat Aug 04 01:22:10 +0000 2012	5219	1145	632	8550			0	 this lil man saved me 15 percent on juul pods https://t.co/XFaVN7W006 	  	http://twitter.com/Davis_1414/status/1036811153995956226			'1036811153995956226	1	0	0	0	0	0	1	0			
'910005824	adfnfc5		Sun Oct 28 10:27:00 +0000 2012	2317	157	102	5074			0	 juul addict... 	 \U0001f602 https://t.co/Mn3FijoF9L 	http://twitter.com/adfnfc5/status/1041409274721853440			'1041409274721853440	1	0	0	0	1	0	0	0			addiction
'776253805	ISmokeIt		Thu Aug 23 15:59:46 +0000 2012	18172	25448	3288	100511			0	 10 FOOT VAPE BAG!!!!!!! (WORLD RECORD)  https://t.co/cyahKMy0Dp 	  	http://twitter.com/ISmokeIt/status/1032682107791990785			'1032682107791990785	1	0	1	0	0	0	0	0			
'849933881528668160	VapingAve40		Thu Apr 06 10:36:43 +0000 2017	20	45	60	158610			0	 New Vaping Hellvape Drop Dead RDA https://t.co/KhCUnuhS8r https://t.co/z5vypQSGt2 	  	http://twitter.com/VapingAve40/status/1038672924037722112			'1038672924037722112	1	1	0	0	0	0	0	0			
'2247044898	zncrazyman		Sun Dec 15 11:07:27 +0000 2013	0	16	15	2961			0	" Earning # cryptocurrency for selling my stuff on @Listia! Join me using code ""BKLHFX"" for an extra 25 XNK. I just listed this: VAPE 1100Mah EGO VINYL WRAP  https://t.co/RPxgbRFFMf "	  	http://twitter.com/zncrazyman/status/1036571128288960513			'1036571128288960513	1	1	0	0	0	0	0	0			
'1153763124	prepaid_africa		Wed Feb 06 11:40:46 +0000 2013	28196	5598	239	91214			0	 Didn't I say this in my Juul related tweetstorm of a week or so ago? 	 1/This story about Big Tobacco using Instagram to hook teens on Juul is a must- read @BySheilaKaplan The industry that brought us the Marlboro Man and Joe Camel -  she writes -  has latched onto the selfie generation in a way that skirts old advertising rules https://t.co/NdxxoAeal1 	http://twitter.com/prepaid_africa/status/1034408021806469120			'1034408021806469120	1	0	0	0	0	0	1	0			
'771706211179892737	Laurenrowe__		Fri Sep 02 13:47:53 +0000 2016	2354	535	349	1872			0	 DONT FUCKING VAPE ON THE PIZZA 	  	http://twitter.com/Laurenrowe__/status/1041393774402957312			'1041393774402957312	1	0	0	0	0	0	0	1			
'1041023673564639232	OfExplcration		Sat Sep 15 17:59:19 +0000 2018	3	14	17	42			0	 @HxppyAesthetic As Colby got home -  he rushed upstairs to make himself look presentable -  threw his flashlights and a camera in his bag -  along with his vape and a few drinks.  _newline_  On the way out the door he grabbed his penny board and shoved it in his bag- you can never be too prepared. 	  	http://twitter.com/OfExplcration/status/1041234123036209154			'1041234123036209154	1	0	0	0	0	0	1	0			
'849933881528668160	VapingAve40		Thu Apr 06 10:36:43 +0000 2017	20	44	59	173950			0	 New Vaping Justfog C601 Pod Kit https://t.co/dzVLZeCdXP https://t.co/ik04n7jOt7 	  	http://twitter.com/VapingAve40/status/1040593566668533762			'1040593566668533762	1	1	0	0	0	0	0	0			
'849933881528668160	VapingAve40		Thu Apr 06 10:36:43 +0000 2017	20	45	60	132745			0	 New Vaping Vaporesso NRG Tank https://t.co/3yykkZ5NeO https://t.co/7avPonsBky 	  	http://twitter.com/VapingAve40/status/1035495461283483649			'1035495461283483649	1	1	0	0	0	0	0	0			
'101491032	RyanPQ		Sun Jan 03 14:41:26 +0000 2010	446	428	1056	601			0	 @smerconish the vape industry did what the FDA couldn't for 40 years. They got teens to think cigarettes are uncool. 	  	http://twitter.com/RyanPQ/status/1040955917632778240			'1040955917632778240	1	0	0	0	0	0	1	0			
'562519446	Nicolas36418315		Tue Apr 24 23:57:01 +0000 2012	0	0	9	22			0	 Vape the buss https://t.co/ksntE0JM3s 	  	http://twitter.com/Nicolas36418315/status/1038583666669056002			'1038583666669056002	1	0	0	0	0	0	0	0			
'849933881528668160	VapingAve40		Thu Apr 06 10:36:43 +0000 2017	20	45	60	105159			0	 New Vaping Vaporesso Cascade Subohm Tank 7ml https://t.co/ydNTGs8VY0 https://t.co/qWnRsP3Hjr 	  	http://twitter.com/VapingAve40/status/1031651792310886400			'1031651792310886400	1	1	0	0	0	0	0	0			
'849933881528668160	VapingAve40		Thu Apr 06 10:36:43 +0000 2017	20	45	60	167677			0	 New Vaping Joyetech eGo AIO Starter Kit New Colors https://t.co/up0k4DcidO https://t.co/8O42vZGQom 	  	http://twitter.com/VapingAve40/status/1039811702487887872			'1039811702487887872	1	1	0	0	0	0	0	0			
'2382855553	VapePenUs		Mon Mar 10 23:49:20 +0000 2014	1767	1407	1160	33096			0	 # Pulsar # GO # VapePen @ https://t.co/XpRzBXpxAp # Vape # Vapelife # Legalize # HighTimes # Cannabis # mmj # thc # Labordaysale https://t.co/D70emudnc0 	  	http://twitter.com/VapePenUs/status/1036726453348515840			'1036726453348515840	1	1	0	0	0	0	0	0			
'1852694772	MadiMasoner		Tue Sep 10 23:15:06 +0000 2013	43679	1591	1541	13306			0	 me and this juul smacking the fuck out of eachother 	  	http://twitter.com/MadiMasoner/status/1035116566256476160			'1035116566256476160	1	0	0	0	0	1	1	0			
'719306551199141888	emwinstead2		Sun Apr 10 23:30:20 +0000 2016	6187	1079	2655	6231			0	" I used to ""vape"" when I'd open a bottle of Pepsi and it would smoke because I thought it was cool. "	  	http://twitter.com/emwinstead2/status/1037845171759669248			'1037845171759669248	1	0	0	0	0	1.1	1	0			
'1021831505830715392	bailey89134869		Tue Jul 24 18:56:30 +0000 2018	73	9	53	31			0	 Im in middle school and it's really sad to me that they had to spend 30min just talking about how we shouldn't be using juuls at our school i dont understand how people my age are doing that. 	  	http://twitter.com/bailey89134869/status/1040841529282244609			'1040841529282244609	1	0	0	0	0	0	0	1			
'2341998785	KasrielYT		Thu Feb 13 20:40:05 +0000 2014	7852	233	304	9641			0	 @iiVoid Vaper Gamer 	  	http://twitter.com/KasrielYT/status/1038900060929568770			'1038900060929568770	1	0	0	0	0	0	0	0			
'3184908341	BigHomieGlo		Sun Apr 19 22:23:10 +0000 2015	9826	1844	867	27171			0	 I'm tryna stop smoking til my born blessed day I been hitting dis vape like it's a wood 	  	http://twitter.com/BigHomieGlo/status/1035312630938914816			'1035312630938914816	1	0	0	0	0	1	1	0			
'21707108	helenyg		Mon Feb 23 23:27:40 +0000 2009	108878	19969	16549	268401			0	 Martin Rowson on vaping and Brexit \u2013 cartoon https://t.co/WD2x1Us0zu 	  	http://twitter.com/helenyg/status/1030717945801048064			'1030717945801048064	1	0	1	0	0	0	0	0			
'893568570411692034	alisonnkimberly		Fri Aug 04 20:25:23 +0000 2017	1	1	15	2			0	 some asshole fish crawled out of the water 40 million years ago and thanks to him we have 14 year olds vaping in the school bathroom 	  	http://twitter.com/alisonnkimberly/status/1041553598063304704			'1041553598063304704	1	0	0	0	0	0	0	1			
'15532687	argiflex		Tue Jul 22 16:01:08 +0000 2008	37472	1351	1136	19999			0	 @l1quidcryst4l A Modem You Can Vape 	  	http://twitter.com/argiflex/status/1041696566397095937			'1041696566397095937	1	0	0	0	0	0	0	0			
'327413188	jak0ltimelow		Fri Jul 01 14:39:57 +0000 2011	93670	1464	2311	108598			0	 I don't need it -  but I'm kind of thinking about saving up for juul -  juul pods + portable juul charger. Just because they look cool huhu oh no 	  	http://twitter.com/jak0ltimelow/status/1039879343286116352			'1039879343286116352	1	0	0	0	0	0	1	0			
'1069639844	tbitchardson		Tue Jan 08 01:09:55 +0000 2013	49963	315	263	30877			0	 when u hit the caffeine juul 	 have not stopped thinking about this since I saw it. it's so good https://t.co/zYYy7moKGX 	http://twitter.com/tbitchardson/status/1034619880509558784			'1034619880509558784	1	0	0	0	0	1	1	0			
'849933881528668160	VapingAve40		Thu Apr 06 10:36:43 +0000 2017	20	45	60	123847			0	 New Vaping Freemax Fireluke Mesh Subohm Tank 3ml https://t.co/VMHEDXRZdI https://t.co/ZLmhMJJXee 	  	http://twitter.com/VapingAve40/status/1034097312014856192			'1034097312014856192	1	1	0	0	0	0	0	0			
'838578349089808384	susanto4515		Mon Mar 06 02:33:53 +0000 2017	0	7	21	11105			0	 # ElectronicCigarettesThe Siblings Red E-Juice For Vape And Electronic Cigarettes 30ML 0Mg + (Does not contain nicotine) - https://t.co/fbtWh1TIHz 	  	http://twitter.com/susanto4515/status/1041290568578478081			'1041290568578478081	1	1	0	0	0	0	0	0			
'241686613	traylmix_		Sat Jan 22 22:08:03 +0000 2011	5150	1143	723	22393			0	" Up until about 4 months ago the ppl who always say ""omg cigs r bad. People r so gross. How can people even smoke a cancer stick!!!"" are the same ones smoking a juul every time they step outside "	  	http://twitter.com/traylmix_/status/1034144850034216963			'1034144850034216963	1	0	0	0	1	0	0	1			
'1001645648209301504	fordingtonne		Wed May 30 02:05:06 +0000 2018	17385	158	271	3454			0	 i saw this guy roll up to this boba place i was at last night in a black suped up honda civic and when he came out of his car he had hair as long as mine with highlights and he took a huge hit of his vape... he is me in an idealized form 	  	http://twitter.com/fordingtonne/status/1034654124837679104			'1034654124837679104	1	0	0	0	0	0	1	0			
'122625918	OujiSan2236		Sat Mar 13 10:05:05 +0000 2010	742	125	508	1995			0	 New Juice # vapecartel R120 # racccity # vapes # winervapes # ruthless # fruitflavors # vgod # promech2 @ Plumstead -  Western Cape -  South Africa https://t.co/rSYgtcKcAS 	  	http://twitter.com/OujiSan2236/status/1040925263645888512	-34.0167		'1040925263645888512	1	1	0	0	0	0	0	0			
'803060181324169217	ash_garn		Mon Nov 28 02:17:22 +0000 2016	5839	478	448	3507			0	 @bdoritocheeto I quit my juul cause it fucked my throat and lungs up so bad. I'm still hackin shit up 	  	http://twitter.com/ash_garn/status/1036740706012934147			'1036740706012934147	1	0	0	0	1	0	0	1			
'1673983669	SavageFrom_Day1		Thu Aug 15 20:03:43 +0000 2013	10227	2290	2584	57879			0	 Left my vape juice at home \U0001f624 	  	http://twitter.com/SavageFrom_Day1/status/1033085660196990976			'1033085660196990976	1	0	0	0	0	0	1	0			
'261800808	thequentinbrock		Sun Mar 06 18:48:29 +0000 2011	3274	1248	649	85045			0	 I quit cigarettes last week _newline_  _newline_ Started vaping -  tastes better and whatnot _newline_  _newline_ BUT... I am stressed and I could really use a cigarette. 	  	http://twitter.com/thequentinbrock/status/1034431807104512000			'1034431807104512000	1	0	0	0	1	0	1	0			
'845449745686564864	DeepFinds		Sat Mar 25 01:38:21 +0000 2017	190	116	0	13630			0	 Juul Labs cofounder James Monsees is coming to Disrupt SF https://t.co/hDb73itx6F https://t.co/2iWnEPE0yD 	  	http://twitter.com/DeepFinds/status/1034488117879889920			'1034488117879889920	1	0	1	0	0	0	0	0			
'3130322991	Smokstore		Tue Mar 31 02:41:52 +0000 2015	21	627	991	737			0	 Aspire cobble Pod AIO Vape kit only $23 per set - built-in 700mah battery - the pod can hold 1.8ml e juice - built-in 1.4ohm nichrome coil - specially designed for nic salts e juice. _newline_ Link: https://t.co/qKAEQhf1il https://t.co/z6kgI2uGJR 	  	http://twitter.com/Smokstore/status/1031444482833756160			'1031444482833756160	1	1	0	0	0	0	0	0			
'849933881528668160	VapingAve40		Thu Apr 06 10:36:43 +0000 2017	20	45	60	122054			0	 New Vaping Smok Stick V8 3000mAh Kit with TFV8 Big Baby https://t.co/VlcDZ6Z7tP https://t.co/4zQHhvxa2V 	  	http://twitter.com/VapingAve40/status/1033912890640588800			'1033912890640588800	1	1	0	0	0	0	0	0			
'923573806324690945	thehouseofvapeu		Thu Oct 26 15:35:29 +0000 2017	0	2	78	6706			0	 Hello world! The Number One Vape Shop https://t.co/u1f803irEo 	  	http://twitter.com/thehouseofvapeu/status/1034221492387696640			'1034221492387696640	1	1	0	0	0	0	0	0			
'849933881528668160	VapingAve40		Thu Apr 06 10:36:43 +0000 2017	20	45	60	104906			0	 New Vaping Vaporesso Estoc Tank Mega 4ml https://t.co/8RKqxpxXa2 https://t.co/bkjfhTP9kN 	  	http://twitter.com/VapingAve40/status/1031608478056374272			'1031608478056374272	1	1	0	0	0	0	0	0			
'849933881528668160	VapingAve40		Thu Apr 06 10:36:43 +0000 2017	20	45	60	167547			0	 New Vaping Geekvape Ammit MTL RDA https://t.co/qhO4QdjshE https://t.co/FZJhG9keyR 	  	http://twitter.com/VapingAve40/status/1039792043759812609			'1039792043759812609	1	1	0	0	0	0	0	0			
'1037365473581690880	Clive37231331		Wed Sep 05 15:42:56 +0000 2018	9	10	8	249			0	 @knightofrigel I have calmed down considerably. Just consider it -  Fernand. I bought a new vape pen yesterday evening. 	  	http://twitter.com/Clive37231331/status/1038160330398949376			'1038160330398949376	1	0	0	0	0	0	1	0			
'263025841	chiroboi		Wed Mar 09 06:33:34 +0000 2011	10258	1139	1963	70524			0	 Friend works for cdc and said their research coming out concludes heavy metal exposure also from outer casing materials of e cigs and vapes. 	 E-cigarettes have sparked debates among health practitioners and smoking cessation advocates -  to say nothing of individual smokers. It's good to see this cogent overview of where the science stands \u2013 featuring @IGTC_Hopkins and @JohnsHopkinsEHE researchers https://t.co/Uo8KdW82iQ 	http://twitter.com/chiroboi/status/1032264841828986884			'1032264841828986884	1	0	0	0	1	0	0	1			
'3156581776	bricavins14		Sat Apr 11 14:22:52 +0000 2015	423	169	2630	4475			0	 New Giveaway up and running. Enter for a chance to win 1 of 6 @VANDYVAPE vape kits # vapemods - https://t.co/NQambB5o8c _newline_  _newline_ # ecigclick # vandyvape # vapegiveaway # vaplyfe # vapefam # vapeon 	  	http://twitter.com/bricavins14/status/1037898027912986624			'1037898027912986624	1	1	0	0	0	0	0	0			
'975149343043973120	queenofthewooks		Sat Mar 17 23:18:15 +0000 2018	12270	603	322	6001			0	" Chrissy and I will be on FaceTime with each other half way across the country like  _newline_  _newline_ ""Wanna come with me to Sheetz to get juul pods?"" "	  	http://twitter.com/queenofthewooks/status/1035013706869092352			'1035013706869092352	1	0	0	0	0	0	1	0			
'954953239337684994	pammy49069859		Sun Jan 21 05:46:09 +0000 2018	1041	49	194	40			0	 @JUULvapor To help with your efforts -  i invite the makers and marketers of Juul to our school district. Speak to parent -  teachers and kids greatly effected. We are in SoCal. We are having a hard time here controlling it. From elementary to high school. 	  	http://twitter.com/pammy49069859/status/1041489483605004288			'1041489483605004288	1	0	0	0	0	0	0	1			
'2443970227	BrisyCoe		Mon Apr 14 14:04:30 +0000 2014	4841	1392	1226	10597			0	 Rules around e-cigarettes should be relaxed so they can be more widely used and accepted in society -  says a report by a committee of MPs. _newline_  _newline_ Are you a vaper? Has it helped you stop smoking? Share your experience with us by emailing haveyoursay@bbc.co.uk _newline_ https://t.co/hUO9J4IQtx 	  	http://twitter.com/BrisyCoe/status/1031335503642148864			'1031335503642148864	1	0	0	1	0	0	1	0			
'2484873420	EcigVapingDeals		Fri May 09 05:04:02 +0000 2014	21649	6705	2830	10702			0	" RT Vaping360 AWESOME VAPE DEALS @ https://t.co/qF8AK9Ypxz ""RT phil_w888: This beaver needs a twitter account. _newline_  _newline_ https://t.co/IiecysdLFH"" # vape # vaping # eliquid # vapelyfe "	  	http://twitter.com/EcigVapingDeals/status/1035645743757975552			'1035645743757975552	1	1	0	0	0	0	0	0			
'2330713417	LindseyLou1983		Thu Feb 06 18:55:04 +0000 2014	41326	561	507	6550			0	 @the_embezzler @FoggyContact Like..... how? How did the ass vaping logistics work out? 	  	http://twitter.com/LindseyLou1983/status/1035682891269857280			'1035682891269857280	1	0	0	0	0	0	0	0			
'1281389126	OvertonPeter		Tue Mar 19 20:03:16 +0000 2013	83	587	324	38349			0	 sik_tipz  -  Punisher Gold/Silver. Fits only 30mm atty's with 810 tip connection. https://t.co/Jz7DrF6D7G # sik_tipz # customdriptips # vape # vapelife # vapemodels # vapemod # vapefam # ejuice... https://t.co/Ow2fkwfv1N 	  	http://twitter.com/OvertonPeter/status/1039978057526861824			'1039978057526861824	1	1	0	0	0	0	0	0			
'849933881528668160	VapingAve40		Thu Apr 06 10:36:43 +0000 2017	20	45	60	126469			0	 New Vaping SMOK Mag Baby 50W TC Kit with TFV12 Baby Prince 1600mAh https://t.co/GLgAjgKZrK https://t.co/JDYzR1Ulal 	  	http://twitter.com/VapingAve40/status/1034457454799536130			'1034457454799536130	1	1	0	0	0	0	0	0			
'938078650292981761	lala_land2000		Tue Dec 05 16:12:33 +0000 2017	50	45	261	176			0	 I can't wait for everyone to breakdown tomorrow when they can't vape at school. 	  	http://twitter.com/lala_land2000/status/1033856832593448960			'1033856832593448960	1	0	0	0	0	0	0	1			
'978729409241894913	alekbethke		Tue Mar 27 20:24:09 +0000 2018	55	18	121	129			0	 Curious monkey meets vape. https://t.co/wYpub91esA 	  	http://twitter.com/alekbethke/status/1035575051247124486			'1035575051247124486	1	0	0	0	0	0	0	0			
'954539510641160192	Hannah_Isner		Sat Jan 20 02:22:08 +0000 2018	308	67	245	42			0	 People who smoke -  drink -  or vape everyday/night it makes you look trashy \U0001f44c\U0001f3fb there is so much better things you could be doing with your life. Sorry not sorry! \U0001f60a 	  	http://twitter.com/Hannah_Isner/status/1031006049912926208			'1031006049912926208	1	0	0	0	0	0	0	1			
'2484873420	EcigVapingDeals		Fri May 09 05:04:02 +0000 2014	21602	6693	2821	11614			0	" RT Vaping360 AWESOME VAPE DEALS @ https://t.co/qF8AK9Ypxz ""Best Box Mods _newline_ https://t.co/0THREPGNgC"" # vape # vaping # eliquid # vapelyfe "	  	http://twitter.com/EcigVapingDeals/status/1040918719634046976			'1040918719634046976	1	1	0	0	0	0	0	0			
'2788797667	beNICEpromo		Wed Sep 03 23:04:01 +0000 2014	2830	3916	4111	5923			0	 Skate Vape Repeat https://t.co/bMdLYvt6gw 	  	http://twitter.com/beNICEpromo/status/1040285228865085442			'1040285228865085442	1	0	0	0	0	0	1	0			
'703614966	almondeeznuts		Wed Jul 18 19:07:32 +0000 2012	9289	160	176	6771			0	 @Black__Sheep13 @christtiinnaaa @BassCanyon @Excision just to inform you - that was LiveNation security which is not part of Excision's team. The rule was unopened Vape juice and empty vape cartridge. 	  	http://twitter.com/almondeeznuts/status/1034658213176651777			'1034658213176651777	1	0	0	1	0	0	0	0			
'362075691	Giosmojosodope		Thu Aug 25 20:21:48 +0000 2011	81435	1099	602	133748			0	 Anyone got a Juul I can borrow? My pods dry 	  	http://twitter.com/Giosmojosodope/status/1035640794873516034			'1035640794873516034	1	0	0	0	0	1.2	1	0			
'189719319	bernxdette		Sun Sep 12 01:36:06 +0000 2010	28732	948	656	29984			0	 found my third juul so we're chillin 	 i've lost my 4th juul i could cry 	http://twitter.com/bernxdette/status/1039373154668486657			'1039373154668486657	1	0	0	0	0	0	1	0			
'22930969	jooblee		Thu Mar 05 15:24:26 +0000 2009	58908	2176	1397	70024			0	 @eleanorstrouser I just imagine a walking version of those billboards you see around for the vape shops -  it's just a girl in aviators -  surrounded by thick smoke \U0001f604 	  	http://twitter.com/jooblee/status/1036979671580196864			'1036979671580196864	1	0	0	0	0	0	1	0			
