userID	username	utc off	profile created	favorites	followers	following	tweets	retweetID	retweet user	retweet count	text	quote	url	lat	lon	tweetID	relevant	com_vape	news_vape	policy_vape	health_vape	use_vape	pro_vape	anti_vape	procure_vape	addiction_vape	
'1184331750	mallorie_ann		Sat Feb 16 02:00:52 +0000 2013	2532	477	258	7162			0	" Today my professor asked us what three items we would take if stranded on an island and without hesitation the boy in front of me said ""juul -  juul charger -  juul pods"" umm k "	  	http://twitter.com/mallorie_ann/status/1034270630693281793			'1034270630693281793	1	0	0	0	0	0	0	1			
'979521625	Jashbrooksss		Fri Nov 30 01:30:28 +0000 2012	716	199	197	2684			0	 Me to my brother: you hear they're trying to ban juuls from teenagers? _newline_  _newline_ My brother: I'll just smoke cigs then. 	  	http://twitter.com/Jashbrooksss/status/1040364574224990208			'1040364574224990208	1	0	0	1	0	0	0	1			
'849933881528668160	VapingAve40		Thu Apr 06 10:36:43 +0000 2017	20	45	60	114393			0	 New Vaping Wismec Sinuous P80 Kit https://t.co/y6aB3ARPbN https://t.co/fdJ42kZk0a 	  	http://twitter.com/VapingAve40/status/1032935816106897408			'1032935816106897408	1	1	0	0	0	0	0	0			
'849933881528668160	VapingAve40		Thu Apr 06 10:36:43 +0000 2017	20	45	60	166347			0	 New Vaping Smok Vape Pen Plus Starter Kit 3000mAh https://t.co/7CD8QS5XCg https://t.co/d1d6vteHVp 	  	http://twitter.com/VapingAve40/status/1039693441544814592			'1039693441544814592	1	1	0	0	0	0	0	0			
'849933881528668160	VapingAve40		Thu Apr 06 10:36:43 +0000 2017	20	45	60	110631			0	 New Vaping Freemax Mesh Pro Replacement Coil 3pcs https://t.co/QDS839r26y https://t.co/hmHEE6Fzn1 	  	http://twitter.com/VapingAve40/status/1032481615631380480			'1032481615631380480	1	1	0	0	0	0	0	0			
'2334378810	Zack_Kirksey		Sun Feb 09 02:12:48 +0000 2014	5497	432	395	2496			0	 Big shoutout to @Kiersten_218 for returning my juul fully charged. Absolute hero 	  	http://twitter.com/Zack_Kirksey/status/1031258679885148160			'1031258679885148160	1	0	0	0	0	0	1	0			
'25349404	GSU_Research		Thu Mar 19 17:57:01 +0000 2009	1563	3414	523	3605			0	 Does vaping really help smokers quit? In two new studies -  Georgia State researchers upend traditional thinking on e-cigarettes. https://t.co/7TBVgCrpIz https://t.co/vCjCKty50e 	  	http://twitter.com/GSU_Research/status/1039883959302344704			'1039883959302344704	1	0	0	0	1	0	0	0			
'63385592	MonicaKonrath		Thu Aug 06 05:45:02 +0000 2009	46112	1435	1100	19823			0	 @SlicerSupport @wiredup83 Thank you for getting this information out.  Here is a great article about the cancer risks when Juuling.  Also -  according to the article -  it's illegal to purchase if you are under the age of 21.  https://t.co/2jTYta2cws 	  	http://twitter.com/MonicaKonrath/status/1039823074282168320			'1039823074282168320	1	0	0	1	1	0	0	1			
'290447509	Kaylee_Nicole2		Sat Apr 30 08:52:43 +0000 2011	34529	1819	1182	34958			0	 To whoever stole my juul....I hope it explodes in your pocket 	  	http://twitter.com/Kaylee_Nicole2/status/1035561050639347713			'1035561050639347713	1	0	0	0	0	0	1	0			
'932075807324934145	Sky_Penis		Sun Nov 19 02:39:24 +0000 2017	6428	137	35	5490			0	 @CNNPolitics @cnnbrk Oh Yeah & Vaping Is The Problem! _newline_ # CDC  _newline_ # CDCwhistleblower  _newline_ # vapelife https://t.co/ns0Yftz7jn 	  	http://twitter.com/Sky_Penis/status/1033418944399503360			'1033418944399503360	1	0	0	0	0	0	0	1			
'1029699811061256192	fatcloudlol		Wed Aug 15 12:02:20 +0000 2018	115	8	50	84			0	 just blew huge vape clouds that sky turns purple 	  	http://twitter.com/fatcloudlol/status/1035206735450054661			'1035206735450054661	1	0	0	0	0	1	1	0			
'849933881528668160	VapingAve40		Thu Apr 06 10:36:43 +0000 2017	20	45	60	160349			0	 New Vaping VGOD Pro SubTank Coil 5pcs https://t.co/huPPW8E7Ha https://t.co/qrQ4hdbU4G 	  	http://twitter.com/VapingAve40/status/1038900477314748417			'1038900477314748417	1	1	0	0	0	0	0	0			
'975458664940056576	creasingcorbyn		Sun Mar 18 19:47:23 +0000 2018	30580	1172	121	22757			0	 @briskblythe help all the boys r juuling 	  	http://twitter.com/creasingcorbyn/status/1036749507172622336			'1036749507172622336	1	0	0	0	0	0	1	0			
'356565457	Lightningbeault		Wed Aug 17 01:37:55 +0000 2011	9822	206	410	5357			0	 @EmilyBeee Just rip the Juul during the date -  rookie movie gerrit 	  	http://twitter.com/Lightningbeault/status/1035143561367441409			'1035143561367441409	1	0	0	0	0	0	1	0			
'3352430571	jkelovuori		Tue Jun 30 22:21:26 +0000 2015	41910	823	551	15069			0	 @JoodiG @Arindroid @vapeindia @pankajch37 @drjagannath @jyotishelar Yeah -  using this logic -  inhaling even one Juul pod (41 - 3mg of nicotine in a 0 - 7ml pod of 59mg/ml strength) could kill you. Strangely enough -  I haven't heard of a single case of death even though I'm sure millions of Juul pods have been inhaled by now. 	  	http://twitter.com/jkelovuori/status/1036992717237248000			'1036992717237248000	1	0	0	0	1	0	1	0			
'3071458335	frenchkissed_		Thu Mar 05 03:31:37 +0000 2015	3187	95	161	2138			0	 i like vapes cause I HATE smelling like weed 	  	http://twitter.com/frenchkissed_/status/1033153259341602817			'1033153259341602817	1	0	0	0	0	0	1	0			
'920316037467275266	braley_patrick		Tue Oct 17 15:50:16 +0000 2017	478	16	190	691			0	 big dick energy is just being rich and vaping in public 	  	http://twitter.com/braley_patrick/status/1030916907216429056			'1030916907216429056	1	0	0	0	0	0	1	0			
'324675964	dylan_sthompson		Mon Jun 27 01:30:04 +0000 2011	15325	996	289	20282			0	 @malloryregister Juul is life 	  	http://twitter.com/dylan_sthompson/status/1039540464351948801			'1039540464351948801	1	0	0	0	0	0	1	0			
'568775250	Garcia272Omar		Wed May 02 01:29:17 +0000 2012	8118	235	225	16590			0	 Bruh someone in this party has a vape pen and now I'm getting second hand high 	  	http://twitter.com/Garcia272Omar/status/1036106806920077313			'1036106806920077313	1	0	0	0	0	0	0	0			
'710455378	goodsmoke		Sat Oct 12 06:01:26 +0000 2013	717	412	410	923			0	 Tenerife look around the Good Smoke Vape Shop San Eugenio: https://t.co/AcPiR712k4 v\xeda @YouTube 	  	http://twitter.com/goodsmoke/status/1036863363282685952			'1036863363282685952	1	1	0	0	0	0	0	0			
'191087923	plopnl		Wed Sep 15 15:43:43 +0000 2010	26788	1238	1450	42023			0	 Smoking 30 packs of cigarettes _newline_ https://t.co/3Et4Omi9E3 _newline_  _newline_ Vs. _newline_ Vaping 120ml of e-liquid _newline_ https://t.co/hrc3qPetM5 _newline_  _newline_ (not science but gives a pretty clear idea of the difference) _newline_ # esigaret # vaping # ecigs 	  	http://twitter.com/plopnl/status/1037802776229814272			'1037802776229814272	1	0	0	0	1	0	0	0			
'3240976734	erinnicolevick		Wed Jun 10 05:21:58 +0000 2015	10119	437	372	3688			0	 @sunniedupre I can't even leave my vape around man. My niece will pick it up in 2 seconds & start sucking bruh \U0001f62d 	  	http://twitter.com/erinnicolevick/status/1038597424313520129			'1038597424313520129	1	0	0	0	0	0	1	0			
'2418453314	RejohnLunze		Sun Mar 30 04:32:15 +0000 2014	4356	347	360	15270			0	 @keanuulantingan Coolkid vaper 	  	http://twitter.com/RejohnLunze/status/1034433835214098433			'1034433835214098433	1	0	0	0	0	0	0	0			
'897164924924960769	CryptoKarateKid		Mon Aug 14 18:36:01 +0000 2017	948	681	1373	389			0	 @EdKrassen @realDonaldTrump Dude.. we get it... you vape 	  	http://twitter.com/CryptoKarateKid/status/1035851172685303808			'1035851172685303808	1	0	0	0	0	0	1	0			
'45309354	akvinchrist		Sun Jun 07 08:47:21 +0000 2009	433	945	2028	137411			0	" ""Learning With: 'Did Juul Lure Teenagers and Get ""Customers for Life""?'"" by SHANNON DOYNE via NYT The New York Times https://t.co/oold8EXjoo "	  	http://twitter.com/akvinchrist/status/1036903258013528065			'1036903258013528065	1	0	1	0	0	0	0	0			
'849933881528668160	VapingAve40		Thu Apr 06 10:36:43 +0000 2017	20	45	60	131126			0	 New Vaping Geekvape Nova Mod https://t.co/8ta8BFUIIW https://t.co/Ew8H1aQSAR 	  	http://twitter.com/VapingAve40/status/1035281685858775040			'1035281685858775040	1	1	0	0	0	0	0	0			
'743535776797843456	NotABadBoi		Thu Jun 16 20:08:38 +0000 2016	71828	1573	778	20970			0	 your egirl just asked to hit my juul lmfao told her no too HAHAHA 	  	http://twitter.com/NotABadBoi/status/1040462712092864512			'1040462712092864512	1	0	0	0	0	0	1	0			
'279738791	LeighGTurner		Sat Apr 09 22:40:14 +0000 2011	1538	2660	1165	15868			0	 @lauriemcginley2 Just the thing for the vaping toddler. 	  	http://twitter.com/LeighGTurner/status/1034888385058549765			'1034888385058549765	1	0	0	0	0	0	0	0			
'391651487	sedgepaul		Sat Oct 15 22:09:30 +0000 2011	196	17933	19404	123051			0	 UBLO SHORT FILL E Liquid Juice Vape Max VG UK Eliquid Cloud Chase. MAXIMUM TASTE https://t.co/rYAluZqa56 ... ... # tweetmaster # atsocialmedia # vapecommunity # vapefamily # vapenation # vapeshop # VapeTricks # Vape # cloudchaser # vapelife # vapeporn # JBRT18VAPE # SHORTFILL https://t.co/DxTKWG8skv 	  	http://twitter.com/sedgepaul/status/1041317048998154241			'1041317048998154241	1	1	0	0	0	0	0	0			
'849933881528668160	VapingAve40		Thu Apr 06 10:36:43 +0000 2017	20	44	60	175927			0	 New Vaping AWT L8 Charger https://t.co/EtqbuI3uWF https://t.co/mpL9vtSprq 	  	http://twitter.com/VapingAve40/status/1041616509083119616			'1041616509083119616	1	1	0	0	0	0	0	0			
'849933881528668160	VapingAve40		Thu Apr 06 10:36:43 +0000 2017	20	45	60	119271			0	 New Vaping Hellvape Drop Dead RDA https://t.co/KhCUnuhS8r https://t.co/bws5c3EJk8 	  	http://twitter.com/VapingAve40/status/1033522524380745730			'1033522524380745730	1	1	0	0	0	0	0	0			
'631414817	DRPHEELGOODTZ		Mon Jul 09 20:59:43 +0000 2012	1065	9421	10533	23976			0	 TVL/PLAN B Booth # 113 up and running @worldvaporexpo Miami!! Come down for some bangin show deals\U0001f918\U0001f918\U0001f601\U0001f601\U0001f624\U0001f624\U0001f624\U0001f624\U0001f624\U0001f624\U0001f624\U0001f624\U0001f624\U0001f624\U0001f624\U0001f624\U0001f624\U0001f624\U0001f624\U0001f624 _newline_ # vape # vapeon # vapelife # vapelyfe # vapestagram # vapelifestyle... https://t.co/iz8uyyrzgM 	  	http://twitter.com/DRPHEELGOODTZ/status/1040640684225515520	25.798221		'1040640684225515520	1	1	0	0	0	0	0	0			
'849933881528668160	VapingAve40		Thu Apr 06 10:36:43 +0000 2017	20	45	60	122997			0	 New Vaping Hellvape Drop Dead RDA https://t.co/KhCUnuhS8r https://t.co/wfP6vVc0N2 	  	http://twitter.com/VapingAve40/status/1034005787679420416			'1034005787679420416	1	1	0	0	0	0	0	0			
'860329399	johnny_grundl23		Wed Oct 03 20:52:17 +0000 2012	2576	292	365	1867			0	 Each Juul should come with a tracking number so you can track it when you lose it. @JUULvapor 	  	http://twitter.com/johnny_grundl23/status/1035900206552936448			'1035900206552936448	1	0	0	0	0	0	1	0			
'849933881528668160	VapingAve40		Thu Apr 06 10:36:43 +0000 2017	20	45	60	155443			0	 New Vaping Voopoo Caliber 110W Starter Kit with Uforce Tank https://t.co/s8xA1YZJI1 https://t.co/CY1NzaH5k0 	  	http://twitter.com/VapingAve40/status/1038244638698553344			'1038244638698553344	1	1	0	0	0	0	0	0			
'858053482405912576	BryanGonz2036		Fri Apr 28 20:21:06 +0000 2017	74703	298	395	16479			0	 Even though I think vaping is stupid -  i think the FDA should chill and not crackdown on it. I think the only thing they should do is encourage enforcement of 18 as the minimum age 	" ""we are going to have to contemplate actions that may narrow the off-ramp for adults who see e-cigarettes as a viable alternative to combustible tobacco in order to close the on ramp for kids. It's an unfortunate trade-off."" FDA Targets Vaping https://t.co/SVDIrgYchn "	http://twitter.com/BryanGonz2036/status/1040351928335704064			'1040351928335704064	1	0	0	1	0	0	0	1			
'452740620	BigTimeCarly		Mon Jan 02 05:50:21 +0000 2012	109789	1397	1174	51119			0	" ""you smell like vape"" "	  	http://twitter.com/BigTimeCarly/status/1041722422033084420			'1041722422033084420	1	0	0	0	0	0	1	0			
'1024030884	DJR3ALTREE		Thu Dec 20 11:12:16 +0000 2012	728	1147	1292	1368			0	 I liked a @YouTube video https://t.co/NRFuyn3x16 Vape Like a Sir!! K1000 Gandalf Pipe. 	  	http://twitter.com/DJR3ALTREE/status/1032912131081924610			'1032912131081924610	1	0	0	0	0	0	1	0			
'700891965160878082	johnhassomesoap		Sat Feb 20 03:57:21 +0000 2016	325	71	199	52			0	 At what point in the friendship is it okay to ask for a hit from their juul 	  	http://twitter.com/johnhassomesoap/status/1036812330728927232			'1036812330728927232	1	0	0	0	0	0	0	0			
'849933881528668160	VapingAve40		Thu Apr 06 10:36:43 +0000 2017	20	45	60	125288			0	 New Vaping Joyetech eGo AIO Starter Kit New Colors https://t.co/up0k4DcidO https://t.co/ZjxZ3dD3Uf 	  	http://twitter.com/VapingAve40/status/1034278545571213312			'1034278545571213312	1	1	0	0	0	0	0	0			
'2780625976	KeeleKodee		Mon Sep 22 21:39:06 +0000 2014	3206	780	386	4375			0	 Aye wassup it's ya boi lil Juul https://t.co/NJMUG9LTkQ 	  	http://twitter.com/KeeleKodee/status/1035661387106869249			'1035661387106869249	1	0	0	0	0	0	1	0			
'880614051302199296	tradbaby		Fri Jun 30 02:28:45 +0000 2017	140	27	27	118			0	 rt to take a hit from the roblox juul https://t.co/41Z5t4IR8b 	  	http://twitter.com/tradbaby/status/1033827101072400384			'1033827101072400384	1	1	0	0	0	0	0	0			
'418283955	peachuiii		Tue Nov 22 00:12:00 +0000 2011	7457	140	112	2881			0	 When chad said he'd bring his vape to the alpha apple pie mixer 	 Caption this https://t.co/dtxhy1WXJf 	http://twitter.com/peachuiii/status/1030862150661824513			'1030862150661824513	1	0	0	0	0	0	1	0			
'127426495	bernardquijada		Mon Mar 29 04:47:22 +0000 2010	1653	115	389	8474			0	 Is it weird I want.corn flavored vape juice \U0001f937\U0001f3fd\u2642\ufe0f 	  	http://twitter.com/bernardquijada/status/1031254266176888832			'1031254266176888832	1	0	0	0	0	0	1	0			
'340044295	melro67		Fri Jul 22 01:55:27 +0000 2011	14022	128	800	1409			0	 @JustinAbersold @JUULvapor @US_FDA OK. My point is that they shouldn't be banned as a result. it is absurd to do so while leaving cigs legal. Because it is also true that thousands of folks have used JUUL to get off cigs -  and it is a fact that they pose fewer health risks. 	  	http://twitter.com/melro67/status/1040567976439832581			'1040567976439832581	1	0	0	1	1	0	1	0			
'2453763925	wendyespinossa		Sat Apr 19 22:23:38 +0000 2014	4762	291	238	4701			0	 juul: charged >>>> dick: hard 	  	http://twitter.com/wendyespinossa/status/1032149193408696320			'1032149193408696320	1	0	0	0	0	0	1	0			
'2568173343	K_d_a7		Wed May 28 02:10:55 +0000 2014	126	1056	186	30036			0	 @PHealthLawCtr @CDCgov They are still confusing tobacco products with # ecigs. Why continue the orchestrated panic over Juul -  it gives them free promotion? 	  	http://twitter.com/K_d_a7/status/1031653596905914368			'1031653596905914368	1	0	0	0	0	0	0	0			
'1013716820073668608	HiraniTwinkal		Mon Jul 02 09:31:38 +0000 2018	0	1	77	40			0	 Electronic E Cigarette E Shisha Pen 50W 1500mAh Box Mod Starter Kit Pen Vape _newline_ @TheSunFootball https://t.co/5Z7gF8wkJf 	  	http://twitter.com/HiraniTwinkal/status/1033964134298091520			'1033964134298091520	1	1	0	0	0	0	0	0			
'849933881528668160	VapingAve40		Thu Apr 06 10:36:43 +0000 2017	20	45	60	134099			0	 New Vaping Vaporesso Armour Pro kit https://t.co/xaOf1NcpTZ https://t.co/DYobSCyqTA 	  	http://twitter.com/VapingAve40/status/1035676056882012160			'1035676056882012160	1	1	0	0	0	0	0	0			
'849933881528668160	VapingAve40		Thu Apr 06 10:36:43 +0000 2017	20	45	60	156511			0	 New Vaping SMOK Mag Baby 50W TC Kit with TFV12 Baby Prince 1600mAh https://t.co/GLgAjgKZrK https://t.co/fVslOubNeA 	  	http://twitter.com/VapingAve40/status/1038381261629284352			'1038381261629284352	1	1	0	0	0	0	0	0			
'20811190	The_Grim_Weeder		Fri Feb 13 21:59:37 +0000 2009	3174	14232	13378	50788			0	 Few Pics from the Vape Party at Captains Vape Lounge. Tamworth @Ultimate_Juice \U0001f4a8\U0001f4a8# vape # drip # vapes # vapenation # vaper # vaping # vapestagram # vapeon # vapedaily # vapeshop # vapecommunity # eliquid # vapenation  # ultimatejuice # vapemedia # vapelove # dripclub # vapefam # vapejuice https://t.co/A8zvVHx3uR 	  	http://twitter.com/The_Grim_Weeder/status/1039096992817971200			'1039096992817971200	1	1	0	0	0	0	0	0			
'849933881528668160	VapingAve40		Thu Apr 06 10:36:43 +0000 2017	20	45	60	127870			0	 New Vaping SMOK TFV12 Baby Prince Tank https://t.co/edWy36YdUu https://t.co/2NhqsoADS9 	  	http://twitter.com/VapingAve40/status/1034595517508935680			'1034595517508935680	1	1	0	0	0	0	0	0			
'849933881528668160	VapingAve40		Thu Apr 06 10:36:43 +0000 2017	20	45	60	156633			0	 New Vaping VOOPOO Vmate 200W TC Box Mod https://t.co/MLjselzhXC https://t.co/p6BtKeiMX8 	  	http://twitter.com/VapingAve40/status/1038423778051547137			'1038423778051547137	1	1	0	0	0	0	0	0			
'65502728	brooken53		Thu Aug 13 23:41:10 +0000 2009	14969	522	564	3528			0	 Ladies and gentlemen...keep your juul's so that your kids have something to bring to their decade dance 	  	http://twitter.com/brooken53/status/1035277770262294528			'1035277770262294528	1	0	0	0	0	0	1	0			
'849933881528668160	VapingAve40		Thu Apr 06 10:36:43 +0000 2017	20	45	60	158709			0	 New Vaping Geekvape Creed RTA https://t.co/XW4XUFKEKb https://t.co/XCTMTUToqf 	  	http://twitter.com/VapingAve40/status/1038674181024403456			'1038674181024403456	1	1	0	0	0	0	0	0			
'4889375986	svamodapz		Mon Feb 08 18:40:17 +0000 2016	2	41	131	3664			0	 Re-Stock completo Prodotti DEA Flavor _newline_ # vape # vapetricks # vapeporn # vapefam # vapers # vapestagram # vapedaily # vapelyfe # vapeon # vapeworld # vapegirls # vapefamous # vapeallday # vapesociety... https://t.co/oap0xW5KPh 	  	http://twitter.com/svamodapz/status/1031906310600704000			'1031906310600704000	1	1	0	0	0	0	0	0			
'727360528625078272	KopitiamBot		Tue May 03 04:53:58 +0000 2016	0	241	0	238522			0	 Vaping Congressman -  Whose Card Bought Steam Games With Campaign Money -  Indicted On Fraud Charges https://t.co/PJKM6i8AlU https://t.co/BUL7mjZoMF 	  	http://twitter.com/KopitiamBot/status/1032057957117247488			'1032057957117247488	1	0	1	0	0	0	0	0			
'849933881528668160	VapingAve40		Thu Apr 06 10:36:43 +0000 2017	20	45	60	141827			0	 New Vaping Vaporesso Attitude 80W TC Vape Mod https://t.co/fcDN1vrRa8 https://t.co/eAdRQv50br 	  	http://twitter.com/VapingAve40/status/1036631299149066241			'1036631299149066241	1	1	0	0	0	0	0	0			
'892478812218380291	Bkip_Sayless2k		Tue Aug 01 20:15:05 +0000 2017	591	360	451	2054			0	 USA: Juul is hurting the youth  _newline_ Also USA: https://t.co/m9cLbW6pND 	  	http://twitter.com/Bkip_Sayless2k/status/1040310923817308160			'1040310923817308160	1	0	1	0	0	0	0	0			
'2286952672	gooeydisk		Fri Jan 17 00:15:06 +0000 2014	29295	1598	824	28819			0	 can i just juul to death is that allowed 	  	http://twitter.com/gooeydisk/status/1033463722361212929			'1033463722361212929	1	0	0	0	0	0	1	0			
'175477496	Kween_Ladda		Fri Aug 06 18:28:44 +0000 2010	5760	2769	1667	90208			0	 Tweeting \U0001f4f2 & vaping \U0001f4a8 	  	http://twitter.com/Kween_Ladda/status/1036406577945829376			'1036406577945829376	1	0	0	0	0	1	1	0			
'849933881528668160	VapingAve40		Thu Apr 06 10:36:43 +0000 2017	20	45	60	135872			0	 New Vaping Tesla Nano 120W TC Box Mod https://t.co/xVFtD8vicF https://t.co/FFxGjG46MB 	  	http://twitter.com/VapingAve40/status/1035899595048603651			'1035899595048603651	1	1	0	0	0	0	0	0			
'849933881528668160	VapingAve40		Thu Apr 06 10:36:43 +0000 2017	20	45	60	169903			0	 New Vaping Joyetech eGo AIO ECO Starter Kit 650mAh https://t.co/1oHa2pRkgt https://t.co/EnZ5DJ6XwY 	  	http://twitter.com/VapingAve40/status/1040082810302676992			'1040082810302676992	1	1	0	0	0	0	0	0			
'4828100832	vapedotto		Fri Jan 29 01:33:35 +0000 2016	65	11620	97	11119			0	 3FVape Weekly Flash Sale - Up to 29% Off (Aug20 - Aug26) https://t.co/mKQ95Zpf9m # vape # vaping # ecigs 	  	http://twitter.com/vapedotto/status/1031484533789650945			'1031484533789650945	1	1	0	0	0	0	0	0			
'2154165085	dadhutt		Fri Oct 25 04:37:32 +0000 2013	3377	88	344	1601			0	 scratch n sniff juul 	  	http://twitter.com/dadhutt/status/1036883640511291392			'1036883640511291392	1	0	0	0	0	0	1	0			
'231482371	GotDragonUSA		Tue Dec 28 17:04:01 +0000 2010	8	173	369	5259			0	 How To quit smoking w/ JUUL pod refill 2.5% nic salt by https://t.co/pYiiqhCBSK https://t.co/eWIVYgrnjX 	  	http://twitter.com/GotDragonUSA/status/1041464610472296449			'1041464610472296449	1	1	0	0	0	0	0	0			
'1043523398	mripratt		Sat Dec 29 01:05:37 +0000 2012	6275	1011	535	4935			0	 Juuls nasty tho 	  	http://twitter.com/mripratt/status/1032026871029002241			'1032026871029002241	1	0	0	0	0	0	0	1			
'2459700872	WebsiteStoreuk		Wed Apr 23 12:59:00 +0000 2014	2543	352	523	614			0	 Looking to build an ecommerce website? We recently design the website for the vaping and ecigarette supplier Vape Cloud https://t.co/IYhHEZq7q2 # ecommerce # webdesign https://t.co/JEIfbHaeA4 	  	http://twitter.com/WebsiteStoreuk/status/1040153106275680256			'1040153106275680256	1	1	0	0	0	0	0	0			
'999715789	iamtrenth		Sun Dec 09 17:09:32 +0000 2012	21344	363	330	14484			0	 i only love my juul and myself im sorry 	  	http://twitter.com/iamtrenth/status/1041365993107406849			'1041365993107406849	1	0	0	0	0	0	1	0			
'1636585273	MarissaWells		Wed Jul 31 22:38:36 +0000 2013	22426	728	490	12708			0	 big rip to all of our juuls that the inlet took yesterday lmao :((( 	  	http://twitter.com/MarissaWells/status/1036268827292704768			'1036268827292704768	1	0	0	0	0	0	1	0			procure
'849933881528668160	VapingAve40		Thu Apr 06 10:36:43 +0000 2017	20	45	60	97512			0	 New Vaping Smok TFV8 X-Baby Beast Tank - 4ml & 2ml https://t.co/15sqXUicMu https://t.co/jShGaRIS0a 	  	http://twitter.com/VapingAve40/status/1030582004088111104			'1030582004088111104	1	1	0	0	0	0	0	0			
'909938821059321856	DukunVape		Tue Sep 19 00:34:55 +0000 2017	0	7	1	273			0	 Be Happy with our RDA _newline_ . _newline_ In Collaboration of atomixvape X doyan.vape _newline_ . _newline_ Distribute by atomixvape.distribution _newline_  _newline_ # atomixvape # atomixcotton # doyanvape # doyantomix # doit @ KiKi Do You Love Me... https://t.co/hEFm3B0kLb 	  	http://twitter.com/DukunVape/status/1031524905983070210			'1031524905983070210	1	1	0	0	0	0	0	0			
'877952512703184896	OpticSplendor		Thu Jun 22 18:12:45 +0000 2017	90	11	75	83			0	 @flaurest Oh Lord please be subtle about it... and lol I don't think A&W makes vape cartridges just yet but soon... 	  	http://twitter.com/OpticSplendor/status/1039984634128412674			'1039984634128412674	1	0	0	0	0	0	1	0			
'832981922427105284	therealjwiseman		Sat Feb 18 15:55:41 +0000 2017	13169	257	411	9414			0	 I love being an atheist and vaping 'Sweet Jesus Juice'...\U0001f602 https://t.co/2W4AoT8L4r 	  	http://twitter.com/therealjwiseman/status/1041013641737392130			'1041013641737392130	1	0	0	0	0	0	1	0			
'316606693	KalliSnae		Mon Jun 13 18:06:18 +0000 2011	9095	519	364	5241			0	" Attacking vaping with the rhetoric ""Save the Children"" really just pathetic justifying prohibition. We are all the children here -  attacking our children is an attack towards us all. Also the 99.9% former smoking kids vaping.  _newline_ Unbelievable ignorance FDA. _newline_ https://t.co/0qspEDehUU https://t.co/YOIOcS6yIR "	  	http://twitter.com/KalliSnae/status/1040196375236026369			'1040196375236026369	1	0	0	0	0	0	1	0			
'2373096109	olivia111000		Wed Mar 05 03:26:00 +0000 2014	343	143	566	184			0	 Last night was the last time I'll ever have to sweep juul pods and piles of dip out of the sonic parking lot -  thank god. 	  	http://twitter.com/olivia111000/status/1031159700337946624			'1031159700337946624	1	0	0	0	0	0	0	0			
'1434856958	Announce420		Fri May 17 06:19:12 +0000 2013	25	3599	2703	56851			0	 Feelin all patriotic n shit \U0001f1e8\U0001f1e6: https://t.co/M6uklxYDP2 _newline_  _newline_ # vapes # smokewhat # grenco # reddit 	  	http://twitter.com/Announce420/status/1030545041146691584			'1030545041146691584	1	0	0	0	0	0	1	0			
'3940773928	imgudluvenjoy		Mon Oct 12 21:48:23 +0000 2015	53658	349	324	12512			0	 vape nation 	 Do you vape? You might want to avoid carrying the pen in your pocket from now on ... \U0001f62c https://t.co/T6k8YFyScl 	http://twitter.com/imgudluvenjoy/status/1034738969454542848			'1034738969454542848	1	0	0	0	0	0	1	0			
'714863686	VarsanBharat		Mon Oct 14 18:23:33 +0000 2013	31	40	190	60			0	 electronic e cig cigarette 40W 2200mAh Box Mod Starter Kit Pen Vape Shisha _newline_ @FMSpain https://t.co/PD07gnpN1i 	  	http://twitter.com/VarsanBharat/status/1040846128877629440			'1040846128877629440	1	1	0	0	0	0	0	0			
'1138082304	b00b1ess		Thu Jan 31 22:35:11 +0000 2013	5818	123	245	2586			0	" ""Bro cmon lemme take a hit of ur juul bro"" _newline_ ""It's just a USB"" "	  	http://twitter.com/b00b1ess/status/1038833603877240832			'1038833603877240832	1	0	0	0	0	0	1	0			
'144361143	smaleb		Sun May 16 02:42:13 +0000 2010	22766	132	655	1411			0	 Prairie Vape Tricks and Sausage Benedict (@ The Happy Gnome) on # Yelp https://t.co/an4HZCD8Qy 	  	http://twitter.com/smaleb/status/1033763810333446144			'1033763810333446144	1	1	0	0	0	0	0	0			
'4828100832	vapedotto		Fri Jan 29 01:33:35 +0000 2016	65	11619	97	11148			0	 Be The First One To See This:Eleaf iStick Amnis Kit https://t.co/AoqOOKVIJL # vape # vaping # ecigs 	  	http://twitter.com/vapedotto/status/1031852792980402176			'1031852792980402176	1	1	0	0	0	0	0	0			
'2432522447	Zach_Lawman3		Mon Mar 24 04:25:51 +0000 2014	5404	690	529	5882			0	 My dental office someday will be juul friendly # BigFacts 	  	http://twitter.com/Zach_Lawman3/status/1035315206421970946			'1035315206421970946	1	0	0	1	0	0	1	0			
